AKAL dlm Al Quran.docx.pdf	Haydar Yahya	2013-05-01
Bahagia dihari ke7.docx.pdf	Haydar Yahya
Bangsa Bahasa Nasab Dalam Islam.pdf	Haydar Yahya	2022-01-01
C I N T A.pdf	Haydar Yahya	2020-01-01
Hanya Tuhankah Yang Berpuasa Ramadhan.docx.pdf	Haydar Yahya
ISLAM, NAMA GENERIK SEMUA AGAMA SAMAWI.pdf	Haydar Yahya	2018-02-15
O HASHEM in MEMORIUM.pdf	Haydar Yahya	2009-02-04
Ojo Dumeh Ojo Gumunan Ojo Kagetan.pdf	Haydar Yahya	2017-01-01
Rasulullah Muhammad saw dan Imam Ali as.docx.pdf	Haydar Yahya	2017-01-01
Rujukan Ayat Sesuai Urutan.pdf	Haydar Yahya
Stop Heboh Mazhab.pdf	Haydar Yahya	2015-08-17
